{
  "metadata": {
    "category": "童装",
    "target_market": "US",
    "business_model": "amazon_fba",
    "budget_range": "medium",
    "timestamp": "20251129_172759",
    "generated_at": "2025-11-29T17:27:59.677317"
  },
  "evaluation": {
    "score": 75,
    "result": {
      "opportunity_score": 75,
      "dimension_scores": {
        "trend": 75,
        "market": 75,
        "competition": 75,
        "profit": 75
      },
      "swot_analysis": {
        "strengths": [
          "Potentially strong brand image and innovative product development (if executed well)",
          "Good profit margins if costs are managed effectively"
        ],
        "weaknesses": [
          "Need to establish brand recognition in a competitive market",
          "Reliance on effective cost control and marketing",
          "Inventory management challenges due to seasonality and trends"
        ],
        "opportunities": [
          "Focus on eco-friendly and sustainable clothing lines to meet growing demand",
          "Offer personalized and customized clothing options",
          "Cater to underserved segments, such as clothing insecurity",
          "Develop gender-neutral and inclusive fashion"
        ],
        "threats": [
          "Intense competition from established players like Carter's, The Children's Place, and Nike",
          "Stringent regulations and safety standards",
          "High production costs for sustainable and safe materials",
          "Changing consumer preferences and rapid fashion trends",
          "Economic uncertainty impacting consumer spending"
        ]
      },
      "recommendation": "cautious",
      "recommendation_detail": "The US children's clothing market presents a moderate opportunity. The market is large and growing, but also highly competitive. Success requires a strong focus on differentiation, cost management, and adapting to evolving consumer preferences. Proceed with caution and a well-defined strategy.",
      "key_risks": [
        "Failure to establish brand recognition and loyalty",
        "Inability to compete on price with established brands",
        "Supply chain disruptions and rising production costs",
        "Changing fashion trends leading to inventory obsolescence",
        "Economic downturn affecting consumer spending on non-essential items"
      ],
      "success_factors": [
        "Develop a strong brand identity and value proposition",
        "Focus on high-quality, durable, and safe products",
        "Implement effective cost control measures",
        "Establish a robust online presence and omnichannel strategy",
        "Prioritize sustainability and ethical sourcing"
      ]
    }
  },
  "analyses": {
    "trend": "None",
    "market": "None",
    "competition": "None",
    "profit": "None"
  },
  "report_text": "# 童装 Market Opportunity Analysis in the US\n\n## 1. Executive Summary\n\nThis report analyzes the opportunity for 童装 (children's clothing) in the US market. The US children's clothing market presents a moderate opportunity due to its large size and growth potential, but it's also highly competitive [cite: evaluator_agent]. Success hinges on differentiation, cost management, and adapting to evolving consumer preferences [cite: evaluator_agent].\n\n**Overall Score:** 75/100 [cite: evaluator_agent]\n**Recommendation:** Cautious [cite: evaluator_agent]\n\n**Key Highlights:**\n\n*   The US children's apparel market is anticipated to generate approximately USD 54.62 billion in revenue in 2025.\n*   Key trends include a rising demand for eco-friendly fabrics, gender-neutral designs and comfortable yet stylish apparel.\n*   Intense competition exists from established players, stringent regulations and safety standards pose challenges [cite: evaluator_agent].\n\n## 2. Trend Analysis\n\n*   **Search Trend Insights:** The trend for children's clothing is rising, influenced by increased disposable income and a growing emphasis on sustainability and ethical practices [cite: trend_agent].\n*   **Seasonality Patterns:** Significant seasonality exists with peak demand in June, July and December and low months in January, August and September [cite: trend_agent]. Agile inventory management is essential [cite: trend_agent].\n*   **Related Opportunities:** Rising trends include \"summer clothes for kids,\" \"children's shorts,\" \"eco-friendly kids clothing,\" \"gender-neutral kids clothes,\" and \"holiday pajamas kids\" [cite: trend_agent].\n    *   The market is seeing a surge in gender-neutral clothing driven by values of inclusivity, comfort and self-expression.\n\n## 3. Market Analysis\n\n*   **Market Size (TAM/SAM/SOM):**\n    *   TAM (Total Addressable Market): USD 54.62 billion (estimated revenue for the US children's clothing market in 2025) [cite: trend_agent, 1].\n    *   SAM (Serviceable Available Market): USD 40.21 billion (estimated revenue for the US baby and infant clothing market in 2025) [cite: trend_agent].\n    *   SOM (Serviceable Obtainable Market): Not explicitly provided; requires estimation based on specific business resources and competitive positioning [cite: trend_agent].\n*   **Growth Trajectory:** The US children's clothing market is projected to grow at a CAGR of 6.2% from 2025 to 2035.\n*   **Target Customer Segments:**\n    *   Infants (0-2 years): 32.4% market share, prioritize comfort and safety, frequent replacements needed [cite: market_agent, 7].\n    *   Toddlers (3-5 years): Need durable and comfortable clothing for active lifestyles [cite: market_agent].\n    *   Children (6-12 years): Need school uniforms and casual wear [cite: market_agent].\n    *   Teens (13-17 years): Influenced by fashion trends and increasing autonomy [cite: market_agent].\n*   The US market is mature, characterized by frequent seasonal buying and high-value purchases [cite: market_agent, 7].\n\n## 4. Competition Analysis\n\n*   **Competitive Landscape:** Intense competition from established players like Carter's, The Children's Place, Gap Kids/Old Navy, Nike (Kids Division), and H&M Kids [cite: evaluator_agent, competition_agent].\n*   **Pricing Analysis:**\n    *   Price range varies from USD 5 to USD 75 depending on the brand and product type [cite: competition_agent].\n    *   The average market price is around USD 35 [cite: competition_agent].\n    *   A recommended pricing range is USD 25 to USD 60 to balance quality and price [cite: competition_agent].\n*   **Differentiation Opportunities:**\n    *   Focus on eco-friendly and sustainable clothing lines [cite: evaluator_agent, competition_agent].\n    *   Offer personalized and customized clothing options [cite: evaluator_agent, competition_agent].\n    *   Develop gender-neutral and inclusive fashion [cite: evaluator_agent, competition_agent].\n    *    Cater to underserved segments with clothing insecurity [cite: evaluator_agent].\n\n## 5. Profit Analysis\n\n*   **Unit Economics Breakdown:**\n    *   Selling Price: USD 30 (average) [cite: profit_agent].\n    *   Product Cost: USD 8 (average) [cite: profit_agent].\n    *   Shipping Cost: USD 3 (average) [cite: profit_agent].\n    *   Gross Profit: USD 19 [cite: profit_agent].\n    *   Net Profit: USD 7 [cite: profit_agent].\n*   **Margin Analysis:**\n    *   Gross Margin Percentage: 63.33% [cite: profit_agent].\n    *   Net Margin Percentage: 23.33% [cite: profit_agent].\n*   **Investment Requirements:**\n    *   Initial Inventory Investment (for 100 units): USD 800 [cite: profit_agent].\n    *   Monthly Revenue Potential (for 100 units): USD 3,000 [cite: profit_agent].\n    *   Expected ROI (Monthly): 87.5% [cite: profit_agent].\n\n## 6. SWOT Analysis\n\n| Strengths                                                                                                                | Weaknesses                                                                                                                               |\n| :----------------------------------------------------------------------------------------------------------------------- | :--------------------------------------------------------------------------------------------------------------------------------------- |\n| Potentially strong brand image and innovative product development (if executed well) [cite: evaluator_agent]              | Need to establish brand recognition in a competitive market [cite: evaluator_agent]                                                      |\n| Good profit margins if costs are managed effectively [cite: evaluator_agent]                                            | Reliance on effective cost control and marketing [cite: evaluator_agent]                                                              |\n|                                                                                                                        | Inventory management challenges due to seasonality and trends [cite: evaluator_agent]                                                    |\n| Opportunities                                                                                                              | Threats                                                                                                                                  |\n| Focus on eco-friendly and sustainable clothing lines to meet growing demand [cite: evaluator_agent, competition_agent] | Intense competition from established players like Carter's, The Children's Place, and Nike [cite: evaluator_agent, competition_agent] |\n| Offer personalized and customized clothing options [cite: evaluator_agent, competition_agent]                            | Stringent regulations and safety standards [cite: evaluator_agent, competition_agent]                                                    |\n| Cater to underserved segments, such as clothing insecurity [cite: evaluator_agent, competition_agent]                   | High production costs for sustainable and safe materials [cite: evaluator_agent, competition_agent]                                       |\n| Develop gender-neutral and inclusive fashion [cite: evaluator_agent, competition_agent]                                  | Changing consumer preferences and rapid fashion trends [cite: evaluator_agent]                                                          |\n|                                                                                                                        | Economic uncertainty impacting consumer spending [cite: evaluator_agent]                                                              |\n\n## 7. Recommendation\n\n*   **Verdict:** CAUTIOUS [cite: evaluator_agent]\n*   **Supporting Reasoning:** The US children's clothing market offers a moderate opportunity due to its large and growing nature [cite: evaluator_agent]. However, the market is highly competitive, demanding a strong emphasis on differentiation, effective cost management, and adaptation to evolving consumer preferences [cite: evaluator_agent]. A well-defined strategy is crucial for success [cite: evaluator_agent].\n*   **Key Risks:**\n    *   Failure to establish brand recognition and loyalty [cite: evaluator_agent].\n    *   Inability to compete on price with established brands [cite: evaluator_agent].\n    *   Supply chain disruptions and rising production costs [cite: evaluator_agent].\n    *   Changing fashion trends leading to inventory obsolescence [cite: evaluator_agent].\n    *   Economic downturn affecting consumer spending on non-essential items [cite: evaluator_agent].\n*   **Success Factors:**\n    *   Develop a strong brand identity and value proposition [cite: evaluator_agent].\n    *   Focus on high-quality, durable, and safe products [cite: evaluator_agent].\n    *   Implement effective cost control measures [cite: evaluator_agent].\n    *   Establish a robust online presence and omnichannel strategy [cite: evaluator_agent].\n    *   Prioritize sustainability and ethical sourcing [cite: evaluator_agent].\n\n## 8. Action Items\n\n*   **Immediate Next Steps:**\n    *   Conduct thorough market research to identify specific target segments and unmet needs.\n    *   Develop a detailed business plan with a focus on differentiation and cost-effectiveness.\n    *   Establish relationships with sustainable and ethical suppliers.\n*   **Product Recommendations:**\n    *   Develop eco-friendly clothing lines using organic or recycled materials.\n    *   Offer personalized and customized clothing options [cite: competition_agent].\n    *   Design gender-neutral and inclusive fashion collections.\n    *   Focus on durable and multi-functional clothing items.\n*   **Marketing Suggestions:**\n    *   Build a strong brand identity through digital marketing and social media.\n    *   Emphasize sustainability and ethical practices in marketing messages.\n    *   Collaborate with influencers to promote products and reach target audiences.\n    *   Offer loyalty programs and discounts to build customer retention.\n"
}